{
  "schema_version": "1.0",
  "generated_at": "2026-02-03T02:59:38.421036+00:00",
  "system": "gif",
  "source_files": [
    "/data/projects/TheGameJamTemplate@cass-memory-update/src/systems/gif/gif_lua_bindings.cpp"
  ],
  "summary": {
    "usertypes": 1,
    "functions": 10,
    "constants": 0,
    "enums": 0,
    "methods": 0,
    "properties": 10,
    "low_confidence": 0,
    "unrecognized_patterns": 0
  },
  "bindings": {
    "usertypes": [
      {
        "lua_name": "gif",
        "type": "usertype",
        "cpp_type": "",
        "signature": "",
        "doc_id": "sol2_usertype_gif",
        "source_ref": "/data/projects/TheGameJamTemplate@cass-memory-update/src/systems/gif/gif_lua_bindings.cpp:100",
        "extraction_confidence": "medium",
        "tier": 0,
        "verified": false
      }
    ],
    "functions": [
      {
        "lua_name": "gif_table.load",
        "type": "function",
        "cpp_type": "",
        "signature": "",
        "doc_id": "sol2_function_gif_table_load",
        "source_ref": "/data/projects/TheGameJamTemplate@cass-memory-update/src/systems/gif/gif_lua_bindings.cpp:18",
        "extraction_confidence": "medium",
        "tier": 0,
        "verified": false
      },
      {
        "lua_name": "gif_table.update",
        "type": "function",
        "cpp_type": "",
        "signature": "",
        "doc_id": "sol2_function_gif_table_update",
        "source_ref": "/data/projects/TheGameJamTemplate@cass-memory-update/src/systems/gif/gif_lua_bindings.cpp:24",
        "extraction_confidence": "medium",
        "tier": 0,
        "verified": false
      },
      {
        "lua_name": "gif_table.getTexture",
        "type": "function",
        "cpp_type": "",
        "signature": "",
        "doc_id": "sol2_function_gif_table_gettexture",
        "source_ref": "/data/projects/TheGameJamTemplate@cass-memory-update/src/systems/gif/gif_lua_bindings.cpp:30",
        "extraction_confidence": "medium",
        "tier": 0,
        "verified": false
      },
      {
        "lua_name": "gif_table.unloadAll",
        "type": "function",
        "cpp_type": "",
        "signature": "",
        "doc_id": "sol2_function_gif_table_unloadall",
        "source_ref": "/data/projects/TheGameJamTemplate@cass-memory-update/src/systems/gif/gif_lua_bindings.cpp:36",
        "extraction_confidence": "medium",
        "tier": 0,
        "verified": false
      },
      {
        "lua_name": "gif_table.setFrameDelay",
        "type": "function",
        "cpp_type": "",
        "signature": "",
        "doc_id": "sol2_function_gif_table_setframedelay",
        "source_ref": "/data/projects/TheGameJamTemplate@cass-memory-update/src/systems/gif/gif_lua_bindings.cpp:46",
        "extraction_confidence": "medium",
        "tier": 0,
        "verified": false
      },
      {
        "lua_name": "gif_table.getFrameDelay",
        "type": "function",
        "cpp_type": "",
        "signature": "",
        "doc_id": "sol2_function_gif_table_getframedelay",
        "source_ref": "/data/projects/TheGameJamTemplate@cass-memory-update/src/systems/gif/gif_lua_bindings.cpp:54",
        "extraction_confidence": "medium",
        "tier": 0,
        "verified": false
      },
      {
        "lua_name": "gif_table.getFrameCount",
        "type": "function",
        "cpp_type": "",
        "signature": "",
        "doc_id": "sol2_function_gif_table_getframecount",
        "source_ref": "/data/projects/TheGameJamTemplate@cass-memory-update/src/systems/gif/gif_lua_bindings.cpp:63",
        "extraction_confidence": "medium",
        "tier": 0,
        "verified": false
      },
      {
        "lua_name": "gif_table.getCurrentFrameIndex",
        "type": "function",
        "cpp_type": "",
        "signature": "",
        "doc_id": "sol2_function_gif_table_getcurrentframeindex",
        "source_ref": "/data/projects/TheGameJamTemplate@cass-memory-update/src/systems/gif/gif_lua_bindings.cpp:72",
        "extraction_confidence": "medium",
        "tier": 0,
        "verified": false
      },
      {
        "lua_name": "gif_table.isLoaded",
        "type": "function",
        "cpp_type": "",
        "signature": "",
        "doc_id": "sol2_function_gif_table_isloaded",
        "source_ref": "/data/projects/TheGameJamTemplate@cass-memory-update/src/systems/gif/gif_lua_bindings.cpp:81",
        "extraction_confidence": "medium",
        "tier": 0,
        "verified": false
      },
      {
        "lua_name": "gif_table.unload",
        "type": "function",
        "cpp_type": "",
        "signature": "",
        "doc_id": "sol2_function_gif_table_unload",
        "source_ref": "/data/projects/TheGameJamTemplate@cass-memory-update/src/systems/gif/gif_lua_bindings.cpp:87",
        "extraction_confidence": "medium",
        "tier": 0,
        "verified": false
      }
    ],
    "constants": [],
    "enums": [],
    "methods": [],
    "properties": [
      {
        "lua_name": "gif.load",
        "type": "property",
        "cpp_type": "",
        "signature": "",
        "doc_id": "sol2_property_gif_load",
        "source_ref": "/data/projects/TheGameJamTemplate@cass-memory-update/src/systems/gif/gif_lua_bindings.cpp:102",
        "extraction_confidence": "high",
        "tier": 0,
        "verified": false
      },
      {
        "lua_name": "gif.update",
        "type": "property",
        "cpp_type": "",
        "signature": "",
        "doc_id": "sol2_property_gif_update",
        "source_ref": "/data/projects/TheGameJamTemplate@cass-memory-update/src/systems/gif/gif_lua_bindings.cpp:108",
        "extraction_confidence": "high",
        "tier": 0,
        "verified": false
      },
      {
        "lua_name": "gif.getTexture",
        "type": "property",
        "cpp_type": "",
        "signature": "",
        "doc_id": "sol2_property_gif_gettexture",
        "source_ref": "/data/projects/TheGameJamTemplate@cass-memory-update/src/systems/gif/gif_lua_bindings.cpp:114",
        "extraction_confidence": "high",
        "tier": 0,
        "verified": false
      },
      {
        "lua_name": "gif.unloadAll",
        "type": "property",
        "cpp_type": "",
        "signature": "",
        "doc_id": "sol2_property_gif_unloadall",
        "source_ref": "/data/projects/TheGameJamTemplate@cass-memory-update/src/systems/gif/gif_lua_bindings.cpp:120",
        "extraction_confidence": "high",
        "tier": 0,
        "verified": false
      },
      {
        "lua_name": "gif.setFrameDelay",
        "type": "property",
        "cpp_type": "",
        "signature": "",
        "doc_id": "sol2_property_gif_setframedelay",
        "source_ref": "/data/projects/TheGameJamTemplate@cass-memory-update/src/systems/gif/gif_lua_bindings.cpp:126",
        "extraction_confidence": "high",
        "tier": 0,
        "verified": false
      },
      {
        "lua_name": "gif.getFrameDelay",
        "type": "property",
        "cpp_type": "",
        "signature": "",
        "doc_id": "sol2_property_gif_getframedelay",
        "source_ref": "/data/projects/TheGameJamTemplate@cass-memory-update/src/systems/gif/gif_lua_bindings.cpp:132",
        "extraction_confidence": "high",
        "tier": 0,
        "verified": false
      },
      {
        "lua_name": "gif.getFrameCount",
        "type": "property",
        "cpp_type": "",
        "signature": "",
        "doc_id": "sol2_property_gif_getframecount",
        "source_ref": "/data/projects/TheGameJamTemplate@cass-memory-update/src/systems/gif/gif_lua_bindings.cpp:138",
        "extraction_confidence": "high",
        "tier": 0,
        "verified": false
      },
      {
        "lua_name": "gif.getCurrentFrameIndex",
        "type": "property",
        "cpp_type": "",
        "signature": "",
        "doc_id": "sol2_property_gif_getcurrentframeindex",
        "source_ref": "/data/projects/TheGameJamTemplate@cass-memory-update/src/systems/gif/gif_lua_bindings.cpp:144",
        "extraction_confidence": "high",
        "tier": 0,
        "verified": false
      },
      {
        "lua_name": "gif.isLoaded",
        "type": "property",
        "cpp_type": "",
        "signature": "",
        "doc_id": "sol2_property_gif_isloaded",
        "source_ref": "/data/projects/TheGameJamTemplate@cass-memory-update/src/systems/gif/gif_lua_bindings.cpp:150",
        "extraction_confidence": "high",
        "tier": 0,
        "verified": false
      },
      {
        "lua_name": "gif.unload",
        "type": "property",
        "cpp_type": "",
        "signature": "",
        "doc_id": "sol2_property_gif_unload",
        "source_ref": "/data/projects/TheGameJamTemplate@cass-memory-update/src/systems/gif/gif_lua_bindings.cpp:156",
        "extraction_confidence": "high",
        "tier": 0,
        "verified": false
      }
    ]
  },
  "unrecognized_patterns": []
}