{
  "schema_version": "1.0",
  "generated_at": "2026-02-06T23:51:58.111260+00:00",
  "system": "tutorial",
  "source_files": [
    "/Users/joshuashin/Projects/TheGameJamTemplate/src/systems/tutorial/tutorial_system_v2.cpp"
  ],
  "summary": {
    "usertypes": 0,
    "functions": 0,
    "constants": 0,
    "enums": 0,
    "methods": 0,
    "properties": 0,
    "low_confidence": 0,
    "unrecognized_patterns": 4
  },
  "bindings": {
    "usertypes": [],
    "functions": [],
    "constants": [],
    "enums": [],
    "methods": [],
    "properties": []
  },
  "unrecognized_patterns": [
    {
      "line": 37,
      "snippet": "sol::coroutine currentTutorialCoroutine;",
      "file": "/Users/joshuashin/Projects/TheGameJamTemplate/src/systems/tutorial/tutorial_system_v2.cpp"
    },
    {
      "line": 208,
      "snippet": "if (result.status() == sol::call_status::ok) {",
      "file": "/Users/joshuashin/Projects/TheGameJamTemplate/src/systems/tutorial/tutorial_system_v2.cpp"
    },
    {
      "line": 213,
      "snippet": "} else if (result.status() == sol::call_status::yielded) {",
      "file": "/Users/joshuashin/Projects/TheGameJamTemplate/src/systems/tutorial/tutorial_system_v2.cpp"
    },
    {
      "line": 218,
      "snippet": "sol::error err = result;  // Extract the error from the result",
      "file": "/Users/joshuashin/Projects/TheGameJamTemplate/src/systems/tutorial/tutorial_system_v2.cpp"
    }
  ]
}