{
  "schema_version": "1.0",
  "generated_at": "2026-02-06T23:51:58.112701+00:00",
  "system": "render_groups",
  "source_files": [
    "/Users/joshuashin/Projects/TheGameJamTemplate/src/systems/render_groups/render_groups.cpp"
  ],
  "summary": {
    "usertypes": 0,
    "functions": 0,
    "constants": 0,
    "enums": 0,
    "methods": 0,
    "properties": 0,
    "low_confidence": 0,
    "unrecognized_patterns": 0
  },
  "bindings": {
    "usertypes": [],
    "functions": [],
    "constants": [],
    "enums": [],
    "methods": [],
    "properties": []
  },
  "unrecognized_patterns": []
}