{
  "schema_version": "1.0",
  "generated_at": "2026-02-06T23:51:58.128254+00:00",
  "system": "event",
  "source_files": [
    "/Users/joshuashin/Projects/TheGameJamTemplate/src/systems/event/event_system.cpp"
  ],
  "summary": {
    "usertypes": 0,
    "functions": 7,
    "constants": 0,
    "enums": 0,
    "methods": 0,
    "properties": 0,
    "low_confidence": 0,
    "unrecognized_patterns": 3
  },
  "bindings": {
    "usertypes": [],
    "functions": [
      {
        "lua_name": "publishLuaEvent",
        "type": "function",
        "cpp_type": "",
        "signature": "",
        "doc_id": "sol2_function_publishluaevent",
        "source_ref": "/Users/joshuashin/Projects/TheGameJamTemplate/src/systems/event/event_system.cpp:218",
        "extraction_confidence": "high",
        "tier": 0,
        "verified": false
      },
      {
        "lua_name": "publishLuaEventNoArgs",
        "type": "function",
        "cpp_type": "",
        "signature": "",
        "doc_id": "sol2_function_publishluaeventnoargs",
        "source_ref": "/Users/joshuashin/Projects/TheGameJamTemplate/src/systems/event/event_system.cpp:232",
        "extraction_confidence": "high",
        "tier": 0,
        "verified": false
      },
      {
        "lua_name": "resetListenersForLuaEvent",
        "type": "function",
        "cpp_type": "",
        "signature": "",
        "doc_id": "sol2_function_resetlistenersforluaevent",
        "source_ref": "/Users/joshuashin/Projects/TheGameJamTemplate/src/systems/event/event_system.cpp:246",
        "extraction_confidence": "high",
        "tier": 0,
        "verified": false
      },
      {
        "lua_name": "resetListenersForCppEvent",
        "type": "function",
        "cpp_type": "",
        "signature": "",
        "doc_id": "sol2_function_resetlistenersforcppevent",
        "source_ref": "/Users/joshuashin/Projects/TheGameJamTemplate/src/systems/event/event_system.cpp:257",
        "extraction_confidence": "high",
        "tier": 0,
        "verified": false
      },
      {
        "lua_name": "clearAllListeners",
        "type": "function",
        "cpp_type": "",
        "signature": "",
        "doc_id": "sol2_function_clearalllisteners",
        "source_ref": "/Users/joshuashin/Projects/TheGameJamTemplate/src/systems/event/event_system.cpp:276",
        "extraction_confidence": "high",
        "tier": 0,
        "verified": false
      },
      {
        "lua_name": "getEventOccurred",
        "type": "function",
        "cpp_type": "",
        "signature": "",
        "doc_id": "sol2_function_geteventoccurred",
        "source_ref": "/Users/joshuashin/Projects/TheGameJamTemplate/src/systems/event/event_system.cpp:289",
        "extraction_confidence": "high",
        "tier": 0,
        "verified": false
      },
      {
        "lua_name": "setEventOccurred",
        "type": "function",
        "cpp_type": "",
        "signature": "",
        "doc_id": "sol2_function_seteventoccurred",
        "source_ref": "/Users/joshuashin/Projects/TheGameJamTemplate/src/systems/event/event_system.cpp:300",
        "extraction_confidence": "high",
        "tier": 0,
        "verified": false
      }
    ],
    "constants": [],
    "enums": [],
    "methods": [],
    "properties": []
  },
  "unrecognized_patterns": [
    {
      "line": 14,
      "snippet": "std::unordered_map<std::string, std::vector<sol::function>> luaEventListeners{};",
      "file": "/Users/joshuashin/Projects/TheGameJamTemplate/src/systems/event/event_system.cpp"
    },
    {
      "line": 151,
      "snippet": "[](const std::string& eventType, sol::function listener) {",
      "file": "/Users/joshuashin/Projects/TheGameJamTemplate/src/systems/event/event_system.cpp"
    },
    {
      "line": 206,
      "snippet": "[](const std::string& eventType, sol::function listener) {",
      "file": "/Users/joshuashin/Projects/TheGameJamTemplate/src/systems/event/event_system.cpp"
    }
  ]
}